{
  "$schema": "walking-v1.schema.json",
  "acceptance": {
    "aggregation": {
      "all_command_start_seed_cells_required": true,
      "classification": "pass only when every coverage/integrity requirement and every metric threshold passes",
      "ppo_return_is_success_metric": false,
      "required_episode_count": 230
    },
    "assistance": {
      "command_resampling": false,
      "curriculum": false,
      "domain_randomization": false,
      "early_termination_suppression": false,
      "external_pushes": false,
      "observation_noise": false,
      "random_actuator_or_sensor_delay": false,
      "state_or_action_correction": false
    },
    "candidate_outcomes_inspected": false,
    "commands": [
      {
        "body_pose": [
          0.0,
          0.0,
          0.0,
          0.0,
          0.0,
          0.0
        ],
        "head_pose": [
          0.0,
          0.0,
          0.0,
          0.0
        ],
        "id": "stop",
        "twist": [
          0.0,
          0.0,
          0.0
        ]
      },
      {
        "body_pose": [
          0.0,
          0.0,
          0.0,
          0.0,
          0.0,
          0.0
        ],
        "head_pose": [
          0.0,
          0.0,
          0.0,
          0.0
        ],
        "id": "forward_slow",
        "twist": [
          0.2,
          0.0,
          0.0
        ]
      },
      {
        "body_pose": [
          0.0,
          0.0,
          0.0,
          0.0,
          0.0,
          0.0
        ],
        "head_pose": [
          0.0,
          0.0,
          0.0,
          0.0
        ],
        "id": "forward_max",
        "twist": [
          0.4,
          0.0,
          0.0
        ]
      },
      {
        "body_pose": [
          0.0,
          0.0,
          0.0,
          0.0,
          0.0,
          0.0
        ],
        "head_pose": [
          0.0,
          0.0,
          0.0,
          0.0
        ],
        "id": "backward_slow",
        "twist": [
          -0.2,
          0.0,
          0.0
        ]
      },
      {
        "body_pose": [
          0.0,
          0.0,
          0.0,
          0.0,
          0.0,
          0.0
        ],
        "head_pose": [
          0.0,
          0.0,
          0.0,
          0.0
        ],
        "id": "backward_max",
        "twist": [
          -0.4,
          0.0,
          0.0
        ]
      },
      {
        "body_pose": [
          0.0,
          0.0,
          0.0,
          0.0,
          0.0,
          0.0
        ],
        "head_pose": [
          0.0,
          0.0,
          0.0,
          0.0
        ],
        "id": "left_max",
        "twist": [
          0.0,
          0.3,
          0.0
        ]
      },
      {
        "body_pose": [
          0.0,
          0.0,
          0.0,
          0.0,
          0.0,
          0.0
        ],
        "head_pose": [
          0.0,
          0.0,
          0.0,
          0.0
        ],
        "id": "right_max",
        "twist": [
          0.0,
          -0.3,
          0.0
        ]
      },
      {
        "body_pose": [
          0.0,
          0.0,
          0.0,
          0.0,
          0.0,
          0.0
        ],
        "head_pose": [
          0.0,
          0.0,
          0.0,
          0.0
        ],
        "id": "turn_left_slow",
        "twist": [
          0.0,
          0.0,
          0.5
        ]
      },
      {
        "body_pose": [
          0.0,
          0.0,
          0.0,
          0.0,
          0.0,
          0.0
        ],
        "head_pose": [
          0.0,
          0.0,
          0.0,
          0.0
        ],
        "id": "turn_left_max",
        "twist": [
          0.0,
          0.0,
          1.0
        ]
      },
      {
        "body_pose": [
          0.0,
          0.0,
          0.0,
          0.0,
          0.0,
          0.0
        ],
        "head_pose": [
          0.0,
          0.0,
          0.0,
          0.0
        ],
        "id": "turn_right_slow",
        "twist": [
          0.0,
          0.0,
          -0.5
        ]
      },
      {
        "body_pose": [
          0.0,
          0.0,
          0.0,
          0.0,
          0.0,
          0.0
        ],
        "head_pose": [
          0.0,
          0.0,
          0.0,
          0.0
        ],
        "id": "turn_right_max",
        "twist": [
          0.0,
          0.0,
          -1.0
        ]
      },
      {
        "body_pose": [
          0.0,
          0.0,
          0.0,
          0.0,
          0.0,
          0.0
        ],
        "head_pose": [
          0.0,
          0.0,
          0.0,
          0.0
        ],
        "id": "forward_left",
        "twist": [
          0.3,
          0.0,
          0.5
        ]
      },
      {
        "body_pose": [
          0.0,
          0.0,
          0.0,
          0.0,
          0.0,
          0.0
        ],
        "head_pose": [
          0.0,
          0.0,
          0.0,
          0.0
        ],
        "id": "forward_right",
        "twist": [
          0.3,
          0.0,
          -0.5
        ]
      },
      {
        "body_pose": [
          0.0,
          0.0,
          0.0,
          0.0,
          0.0,
          0.0
        ],
        "head_pose": [
          0.0,
          0.0,
          0.0,
          0.0
        ],
        "id": "backward_left",
        "twist": [
          -0.3,
          0.0,
          0.5
        ]
      },
      {
        "body_pose": [
          0.0,
          0.0,
          0.0,
          0.0,
          0.0,
          0.0
        ],
        "head_pose": [
          0.0,
          0.0,
          0.0,
          0.0
        ],
        "id": "backward_right",
        "twist": [
          -0.3,
          0.0,
          -0.5
        ]
      },
      {
        "body_pose": [
          0.0,
          0.0,
          0.0,
          0.0,
          0.0,
          0.0
        ],
        "head_pose": [
          0.5,
          0.0,
          0.0,
          0.0
        ],
        "id": "neck_up",
        "twist": [
          0.2,
          0.0,
          0.0
        ]
      },
      {
        "body_pose": [
          0.0,
          0.0,
          0.0,
          0.0,
          0.0,
          0.0
        ],
        "head_pose": [
          -0.5,
          0.0,
          0.0,
          0.0
        ],
        "id": "neck_down",
        "twist": [
          0.2,
          0.0,
          0.0
        ]
      },
      {
        "body_pose": [
          0.0,
          0.0,
          0.0,
          0.0,
          0.0,
          0.0
        ],
        "head_pose": [
          0.0,
          0.5,
          0.0,
          0.0
        ],
        "id": "head_pitch_up",
        "twist": [
          0.2,
          0.0,
          0.0
        ]
      },
      {
        "body_pose": [
          0.0,
          0.0,
          0.0,
          0.0,
          0.0,
          0.0
        ],
        "head_pose": [
          0.0,
          -0.5,
          0.0,
          0.0
        ],
        "id": "head_pitch_down",
        "twist": [
          0.2,
          0.0,
          0.0
        ]
      },
      {
        "body_pose": [
          0.0,
          0.0,
          0.0,
          0.0,
          0.0,
          0.0
        ],
        "head_pose": [
          0.0,
          0.0,
          0.7,
          0.0
        ],
        "id": "head_yaw_left",
        "twist": [
          0.2,
          0.0,
          0.0
        ]
      },
      {
        "body_pose": [
          0.0,
          0.0,
          0.0,
          0.0,
          0.0,
          0.0
        ],
        "head_pose": [
          0.0,
          0.0,
          -0.7,
          0.0
        ],
        "id": "head_yaw_right",
        "twist": [
          0.2,
          0.0,
          0.0
        ]
      },
      {
        "body_pose": [
          0.0,
          0.0,
          0.0,
          0.0,
          0.0,
          0.0
        ],
        "head_pose": [
          0.0,
          0.0,
          0.0,
          0.15
        ],
        "id": "head_roll_left",
        "twist": [
          0.2,
          0.0,
          0.0
        ]
      },
      {
        "body_pose": [
          0.0,
          0.0,
          0.0,
          0.0,
          0.0,
          0.0
        ],
        "head_pose": [
          0.0,
          0.0,
          0.0,
          -0.15
        ],
        "id": "head_roll_right",
        "twist": [
          0.2,
          0.0,
          0.0
        ]
      }
    ],
    "episode_duration_s": 10.0,
    "metric_warmup_s": 1.0,
    "metrics": {
      "foot_slip": {
        "stance_speed_m_s_max": 0.2,
        "stance_speed_m_s_p95_max": 0.08
      },
      "integrity": {
        "deadline_measurement": "monotonic wall time around single-thread ONNX Runtime CPU inference; exclude 10 untimed warmup calls and bind the host profile in environment-lock.json",
        "deadline_miss_count_max": 0,
        "evaluator_error_count_max": 0,
        "nan_or_inf_count_max": 0,
        "policy_inference_deadline_ms": 20.0
      },
      "joint_and_torque_margin": {
        "joint_limit_margin_rad_min": 0.02,
        "torque_limit_exceedance_count_max": 0,
        "torque_saturation_fraction_max": 0.02
      },
      "orientation": {
        "absolute_roll_pitch_deg_max": 45.0,
        "absolute_roll_pitch_deg_p95_max": 15.0
      },
      "stop": {
        "absolute_yaw_change_rad_p95_max": 0.35,
        "planar_displacement_m_p95_max": 0.15
      },
      "survival": {
        "fall_rate_max": 0.05,
        "nominal_fraction_min": 0.98,
        "perturbed_fraction_min": 0.9
      },
      "tracking_after_warmup": {
        "head_pose_error_rad_mean_max": 0.15,
        "head_pose_error_rad_p95_max": 0.3,
        "linear_velocity_error_m_s_p95_max": 0.25,
        "linear_velocity_rmse_m_s_mean_max": 0.12,
        "yaw_rate_error_rad_s_p95_max": 0.5,
        "yaw_rate_rmse_rad_s_mean_max": 0.25
      }
    },
    "seed_handling": {